<!--
  ~ Copyright (c) 2020 by European Commission
  ~
  ~ Licensed under the EUPL, Version 1.2 or - as soon they will be
  ~ approved by the European Commission - subsequent versions of the
  ~ EUPL (the "Licence");
  ~ You may not use this work except in compliance with the Licence.
  ~ You may obtain a copy of the Licence at:
  ~ https://joinup.ec.europa.eu/page/eupl-text-11-12
  ~
  ~ Unless required by applicable law or agreed to in writing, software
  ~ distributed under the Licence is distributed on an "AS IS" basis,
  ~ WITHOUT WARRANTIES OR CONDITIONS OF ANY KIND, either express or
  ~ implied.
  ~ See the Licence for the specific language governing permissions and
  ~ limitations under the Licence.
  -->
<lightRequest xmlns="http://cef.eidas.eu/LightRequest" xmlns:xsi="http://www.w3.org/2001/XMLSchema-instance"
              xsi:schemaLocation="http://cef.eidas.eu/LightRequest ../../../../main/resources/xsds/lightRequest.xsd">
    <citizenCountryCode>CA</citizenCountryCode>
    <id>f5e7e0f5-b9b8-4256-a7d0-4090141b326d</id>
    <issuer>http://localhost:7001/SP/metadata</issuer>
    <levelOfAssurance>http://eidas.europa.eu/LoA/low</levelOfAssurance>
    <nameIdFormat>urn:oasis:names:tc:SAML:1.1:nameid-format:unspecified</nameIdFormat>
    <providerName>ProviderName</providerName>
    <spType>public</spType>
    <spCountryCode>CD</spCountryCode>
    <relayState>MyRelayState</relayState>
    <requestedAttributes>
        <attribute>
            <definition>http://eidas.europa.eu/attributes/naturalperson/PersonIdentifier</definition>
        </attribute>
        <attribute>
            <definition>http://eidas.europa.eu/attributes/naturalperson/CurrentFamilyName</definition>
        </attribute>
        <attribute>
            <definition>http://eidas.europa.eu/attributes/naturalperson/CurrentGivenName</definition>
        </attribute>
        <attribute>
            <definition>http://eidas.europa.eu/attributes/naturalperson/BirthName</definition>
        </attribute>
        <attribute>
            <definition>http://eidas.europa.eu/attributes/legalperson/D-2012-17-EUIdentifier</definition>
        </attribute>
        <attribute>
            <definition>http://eidas.europa.eu/attributes/naturalperson/DateOfBirth</definition>
        </attribute>
        <attribute>
            <definition>http://eidas.europa.eu/attributes/legalperson/EORI</definition>
        </attribute>
        <attribute>
            <definition>http://eidas.europa.eu/attributes/naturalperson/Gender</definition>
        </attribute>
        <attribute>
            <definition>http://eidas.europa.eu/attributes/naturalperson/PlaceOfBirth</definition>
        </attribute>
        <attribute>
            <definition>http://eidas.europa.eu/attributes/naturalperson/CurrentAddress</definition>
        </attribute>
    </requestedAttributes>
</lightRequest>
